{
  "$schema": "https://json-schema.org/draft/2020-12/schema",
  "$id": "https://italiano.invalid/schemas/review-file.schema.json",
  "title": "Review file (review-<scope>-<date>.json; filed unchanged in reviews/inbox/)",
  "description": "docs/04 § Content review loop › The review file. Written by the review page (M1.3) and the app's review mode (M6.10); imported by content review-import (M1.13). `files` maps each reviewed file to the hash of the version shown (the approval hash; for docs/13, the hash of its content-questions section). The page also records `elements`, a fingerprint of every element it showed, so `review-export --since` can mark what changed.",
  "type": "object",
  "required": ["format", "reviewer", "channel", "scope", "created", "files", "comments"],
  "properties": {
    "format": {"const": 1},
    "reviewer": {"type": "string"},
    "channel": {"enum": ["page", "app"], "title": "review channel"},
    "scope": {"$ref": "#/$defs/scope"},
    "created": {"type": "string", "format": "date-time"},
    "files": {"$ref": "#/$defs/fileHashes"},
    "comments": {"type": "array", "items": {"$ref": "#/$defs/comment"}},
    "elements": {
      "description": "Review pages only: element target → fingerprint of what the page showed (itcontent.review.fingerprint).",
      "type": "object",
      "propertyNames": {"$ref": "common.schema.json#/$defs/nonEmptyString"},
      "additionalProperties": {
        "type": "string",
        "pattern": "^[0-9a-f]{16}$",
        "x-message": "'{value}' is not an element fingerprint (16 hex digits)"
      }
    },
    "signoff": {
      "type": ["object", "null"],
      "required": ["name", "at", "files"],
      "properties": {
        "name": {"$ref": "common.schema.json#/$defs/nonEmptyString"},
        "at": {"type": "string", "format": "date-time"},
        "files": {"$ref": "#/$defs/fileHashes"}
      },
      "additionalProperties": false
    }
  },
  "additionalProperties": false,
  "$defs": {
    "scope": {
      "type": "string",
      "pattern": "^(?:specs|assessments|u\\d{2})$",
      "x-message": "'{value}' is not a review scope (specs, assessments or uNN)"
    },
    "path": {
      "type": "string",
      "pattern": "^(?:content/[^\\s]+\\.yaml|docs/13-decisions\\.md)$",
      "x-message": "'{value}' is not a content file path like content/units/02-al-bar/lesson-1.yaml (or docs/13-decisions.md for the content questions)"
    },
    "hash": {
      "type": "string",
      "pattern": "^[0-9a-f]{64}$",
      "x-message": "'{value}' is not an approval hash (sha256 hex, docs/04 § Approval hash)"
    },
    "fileHashes": {
      "type": "object",
      "propertyNames": {"$ref": "#/$defs/path"},
      "additionalProperties": {"$ref": "#/$defs/hash"}
    },
    "commentFields": {
      "description": "The fields of one comment, shared with the ledger (review-ledger.schema.json).",
      "properties": {
        "id": {"$ref": "common.schema.json#/$defs/nonEmptyString"},
        "target": {"$ref": "common.schema.json#/$defs/nonEmptyString"},
        "file": {"$ref": "#/$defs/path"},
        "quote": {"type": ["string", "null"]},
        "verdict": {"enum": ["ok", "change", "question"], "title": "verdict"},
        "category": {
          "description": "The keys of itcontent.review.CATEGORIES (and the app's ReviewComment.Category); a test keeps the three in step.",
          "enum": ["italian-error", "naturalness", "level", "answer-key", "hint-or-rule", "english", "culture-or-facts", "audio", "other", null],
          "x-message": "'{value}' is not a review category (allowed: italian-error, naturalness, level, answer-key, hint-or-rule, english, culture-or-facts, audio, other)"
        },
        "comment": {"type": ["string", "null"]},
        "suggestion": {"type": ["string", "null"]},
        "response": {"type": ["string", "null"]},
        "adjudication": {
          "description": "Answers to adjudicate (task M8.3): the teacher's decision on a rejected learner answer (`response`). `near` adds it as a near-miss with `hint` (`outcome: almost` when it is nearly right); `intent` picks the conversation intent it belongs to; `count` is how often learners gave it.",
          "type": ["object", "null"],
          "required": ["decision"],
          "properties": {
            "decision": {"enum": ["accept", "near", "wrong"], "title": "adjudication decision"},
            "hint": {"type": ["string", "null"]},
            "outcome": {"enum": ["almost", null], "x-message": "'{value}' is not a near-miss outcome (almost or null)"},
            "intent": {"type": ["string", "null"]},
            "count": {"type": ["integer", "null"], "minimum": 1}
          },
          "additionalProperties": false
        },
        "reopens": {
          "description": "The id of an earlier comment the teacher reopened on a --since page.",
          "type": ["string", "null"]
        },
        "at": {"type": "string", "format": "date-time"}
      }
    },
    "comment": {
      "type": "object",
      "required": ["id", "target", "file", "verdict", "at"],
      "$ref": "#/$defs/commentFields",
      "properties": {
        "id": true,
        "target": true,
        "file": true,
        "quote": true,
        "verdict": true,
        "category": true,
        "comment": true,
        "suggestion": true,
        "response": true,
        "adjudication": true,
        "reopens": true,
        "at": true
      },
      "additionalProperties": false
    }
  }
}
