{
  "format": 1,
  "reviewer": "Maria Rossi",
  "channel": "page",
  "scope": "u02",
  "created": "2026-10-20T09:12:00Z",
  "files": {
    "content/items/u02.yaml": "2a668bc9778e521a013e587f7a82f27421767c4807c409c7d657964ed71526cd",
    "content/units/02-al-bar/lesson-1.yaml": "b9c81449cd6f990dd525665326f382a1ee1f6bdde629dcd8cfacbdc8f1f574c2",
    "content/units/02-al-bar/task.yaml": "97d555fa7b4b457c7cba793cb7135dfa5740501efff547fc166d953ac0432392",
    "content/units/02-al-bar/check.yaml": "75eff8120c56861688fc81125b9904a84c5f453e4913c6293b1d56fd1465e860"
  },
  "comments": [
    {
      "id": "5e1d0c2a-7b3f-4c1e-9a6d-000000000001",
      "target": "u02.l1.story#3",
      "file": "content/units/02-al-bar/lesson-1.yaml",
      "quote": "Buongiorno. Vorrei un cappuccino, per favore.",
      "verdict": "change",
      "category": "naturalness",
      "comment": "At the counter most people just say «Un cappuccino, per favore». Vorrei is fine, but Buongiorno + vorrei sounds a little stiff.",
      "suggestion": "Buongiorno! Un cappuccino, per favore.",
      "response": null,
      "at": "2026-10-20T09:15:00Z"
    },
    {
      "id": "5e1d0c2a-7b3f-4c1e-9a6d-000000000002",
      "target": "u02.l1.ex07",
      "file": "content/units/02-al-bar/lesson-1.yaml",
      "quote": "quant'è",
      "verdict": "change",
      "category": "answer-key",
      "comment": "This should be accepted: very common at the counter.",
      "suggestion": null,
      "response": "quanto viene",
      "at": "2026-10-20T09:17:00Z"
    },
    {
      "id": "5e1d0c2a-7b3f-4c1e-9a6d-000000000003",
      "target": "u02.task.conv1/n2",
      "file": "content/units/02-al-bar/task.yaml",
      "quote": "Certo. E da mangiare?",
      "verdict": "question",
      "category": "hint-or-rule",
      "comment": "Should the learner know that «No, grazie» is a fine answer here? The help chips show it, the hint doesn't.",
      "suggestion": null,
      "response": null,
      "at": "2026-10-20T09:19:00Z"
    },
    {
      "id": "5e1d0c2a-7b3f-4c1e-9a6d-000000000004",
      "target": "w:cornetto",
      "file": "content/items/u02.yaml",
      "quote": "cornetto",
      "verdict": "ok",
      "category": null,
      "comment": null,
      "suggestion": null,
      "response": null,
      "at": "2026-10-20T09:20:00Z"
    },
    {
      "id": "5e1d0c2a-7b3f-4c1e-9a6d-000000000005",
      "target": "u02.l1.note",
      "file": "content/units/02-al-bar/lesson-1.yaml",
      "quote": "un, una and un'",
      "verdict": "change",
      "category": "english",
      "comment": "«Did you spot it?» reads a bit childish for adult learners.",
      "suggestion": null,
      "response": null,
      "at": "2026-10-20T09:22:00Z"
    },
    {
      "id": "5e1d0c2a-7b3f-4c1e-9a6d-000000000006",
      "target": "u02.check.05",
      "file": "content/units/02-al-bar/check.yaml",
      "quote": "Vorrei una spremuta, per favore.",
      "verdict": "ok",
      "category": null,
      "comment": "Good item; keep it.",
      "suggestion": null,
      "response": null,
      "at": "2026-10-20T09:24:00Z"
    },
    {
      "id": "5e1d0c2a-7b3f-4c1e-9a6d-000000000007",
      "target": "cd:order-food-drink",
      "file": "content/units/02-al-bar/unit.yaml",
      "quote": "Order food and drink",
      "verdict": "question",
      "category": "level",
      "comment": "Is ordering for a friend (per me e per la mia amica) part of this can-do, or later?",
      "suggestion": null,
      "response": null,
      "at": "2026-10-20T09:26:00Z"
    }
  ],
  "signoff": null
}
