{
  "format": 1,
  "reviewer": "Maria Rossi",
  "channel": "page",
  "scope": "u02",
  "created": "2026-11-03T18:05:00Z",
  "files": {
    "content/items/u02.yaml": "2a668bc9778e521a013e587f7a82f27421767c4807c409c7d657964ed71526cd",
    "content/units/02-al-bar/lesson-1.yaml": "b9c81449cd6f990dd525665326f382a1ee1f6bdde629dcd8cfacbdc8f1f574c2",
    "content/units/02-al-bar/task.yaml": "97d555fa7b4b457c7cba793cb7135dfa5740501efff547fc166d953ac0432392",
    "content/units/02-al-bar/check.yaml": "75eff8120c56861688fc81125b9904a84c5f453e4913c6293b1d56fd1465e860"
  },
  "comments": [
    {
      "id": "5e1d0c2a-7b3f-4c1e-9a6d-000000000011",
      "target": "u02.l1.ex04",
      "file": "content/units/02-al-bar/lesson-1.yaml",
      "quote": "un cornetto",
      "verdict": "change",
      "category": "answer-key",
      "comment": null,
      "suggestion": null,
      "response": "il cornetto",
      "at": "2026-10-20T09:06:00Z",
      "adjudication": {
        "decision": "accept",
        "hint": null,
        "outcome": null,
        "intent": null,
        "count": 1
      }
    },
    {
      "id": "5e1d0c2a-7b3f-4c1e-9a6d-000000000012",
      "target": "u02.task.conv1/n1",
      "file": "content/units/02-al-bar/task.yaml",
      "quote": "Buongiorno! Cosa prende?",
      "verdict": "change",
      "category": "answer-key",
      "comment": null,
      "suggestion": null,
      "response": "vorrei cappuccino",
      "at": "2026-10-20T09:07:00Z",
      "adjudication": {
        "decision": "near",
        "hint": "Don't forget the article: un cappuccino.",
        "outcome": "almost",
        "intent": null,
        "count": 1
      }
    },
    {
      "id": "5e1d0c2a-7b3f-4c1e-9a6d-000000000013",
      "target": "u02.l1.ex04",
      "file": "content/units/02-al-bar/lesson-1.yaml",
      "quote": "un cornetto",
      "verdict": "ok",
      "category": "answer-key",
      "comment": null,
      "suggestion": null,
      "response": "una cornetto",
      "at": "2026-10-20T09:08:00Z",
      "adjudication": {
        "decision": "wrong",
        "hint": null,
        "outcome": null,
        "intent": null,
        "count": 3
      }
    }
  ],
  "signoff": null
}
