{
  "channel" : "app",
  "comments" : [
    {
      "at" : "2026-10-06T07:30:00Z",
      "category" : "answer-key",
      "comment" : "This should be accepted.",
      "file" : "content/units/02-al-bar/lesson-1.yaml",
      "id" : "36c600d5-5645-4e6c-975f-f697adfddcff",
      "quote" : "How much is it?",
      "response" : "quanto fa",
      "suggestion" : null,
      "target" : "u02.l1.ex07",
      "verdict" : "change"
    },
    {
      "at" : "2026-10-06T07:30:00Z",
      "category" : "level",
      "comment" : "Is quanto costa taught by this point?",
      "file" : "content/units/02-al-bar/lesson-1.yaml",
      "id" : "a91bca45-43e6-4778-b804-7b7aae98e443",
      "quote" : "How much is it?",
      "response" : null,
      "suggestion" : null,
      "target" : "u02.l1.ex07",
      "verdict" : "question"
    },
    {
      "at" : "2026-10-06T07:30:00Z",
      "category" : "naturalness",
      "comment" : null,
      "file" : "content/units/02-al-bar/lesson-1.yaml",
      "id" : "91d35d1e-1e3c-4f18-8b5a-5b15c87d8f38",
      "quote" : "Buongiorno. Vorrei un cappuccino, per favore.",
      "response" : null,
      "suggestion" : "Buongiorno! Un cappuccino, per favore.",
      "target" : "u02.l1.story#3",
      "verdict" : "change"
    }
  ],
  "created" : "2026-10-06T07:30:00Z",
  "files" : {
    "content/units/02-al-bar/lesson-1.yaml" : "b9c81449cd6f990dd525665326f382a1ee1f6bdde629dcd8cfacbdc8f1f574c2"
  },
  "format" : 1,
  "reviewer" : "Maria Rossi",
  "scope" : "u02",
  "signoff" : null
}